{
  "schema_version": "1.0.0",
  "manifest_version": "1.0.0",
  "published_at": "2026-09-16T18:00:00Z",
  "targets": [
    {
      "id": "id-indonesia-myrepublic",
      "order": 1,
      "enabled": true,
      "label": "Indonesia",
      "country_code": "ID",
      "city": null,
      "location_confidence": "unverified",
      "sources": [
        {
          "url": "https://github.com/R0GGER/public-iperf3-servers/blob/main/README.md",
          "checked_at": "2026-09-16T16:00:00Z",
          "usage_policy": "public_directory_listed"
        },
        {
          "url": "https://iperf.fr/iperf-servers.php",
          "checked_at": "2026-09-16T16:00:00Z",
          "usage_policy": "public_directory_listed"
        }
      ],
      "endpoints": [
        {
          "id": "myrepublic-tangerang2",
          "priority": 1,
          "hostname": "speedtest.tangerang2.myrepublic.net.id",
          "ports": [9201, 9202, 9203, 9204, 9205, 9206, 9207, 9208, 9209, 9210, 9211, 9212, 9213, 9214, 9215, 9216, 9217, 9218, 9219, 9220, 9221, 9222, 9223, 9224, 9225, 9226, 9227, 9228, 9229, 9230, 9231, 9232, 9233, 9234, 9235, 9236, 9237, 9238, 9239, 9240],
          "supports_reverse": "yes",
          "supports_icmp": "unknown",
          "verification_status": "partially_verified",
          "verified_at": "2026-09-16T17:00:00Z"
        },
        {
          "id": "biznet-indonesia",
          "priority": 2,
          "hostname": "iperf.biznetnetworks.com",
          "ports": [5201, 5202, 5203],
          "supports_reverse": "unknown",
          "supports_icmp": "unknown",
          "verification_status": "unavailable",
          "verified_at": "2025-03-01T00:00:00Z"
        }
      ]
    },
    {
      "id": "sg-singapore-ovh",
      "order": 2,
      "enabled": true,
      "label": "Singapore",
      "country_code": "SG",
      "city": "Singapore",
      "location_confidence": "operator_documented",
      "sources": [
        {
          "url": "https://sgp.proof.ovh.net/",
          "checked_at": "2026-09-16T16:00:00Z",
          "usage_policy": "operator_documented"
        },
        {
          "url": "https://github.com/R0GGER/public-iperf3-servers/blob/main/README.md",
          "checked_at": "2026-09-16T16:00:00Z",
          "usage_policy": "public_directory_listed"
        }
      ],
      "endpoints": [
        {
          "id": "ovh-singapore",
          "priority": 1,
          "hostname": "sgp.proof.ovh.net",
          "ports": [5201, 5202, 5203, 5204, 5205, 5206, 5207, 5208, 5209, 5210],
          "supports_reverse": "yes",
          "supports_icmp": "unknown",
          "verification_status": "verified",
          "verified_at": "2026-09-16T17:00:00Z"
        },
        {
          "id": "leaseweb-singapore-1",
          "priority": 2,
          "hostname": "speedtest.sin1.sg.leaseweb.net",
          "ports": [5201, 5202, 5203, 5204, 5205, 5206, 5207, 5208, 5209, 5210],
          "supports_reverse": "yes",
          "supports_icmp": "unknown",
          "verification_status": "unverified",
          "verified_at": null
        }
      ]
    },
    {
      "id": "jp-tokyo-leaseweb",
      "order": 3,
      "enabled": true,
      "label": "Tokyo",
      "country_code": "JP",
      "city": "Tokyo",
      "location_confidence": "directory_listed",
      "sources": [
        {
          "url": "https://github.com/R0GGER/public-iperf3-servers/blob/main/README.md",
          "checked_at": "2026-09-16T16:00:00Z",
          "usage_policy": "public_directory_listed"
        }
      ],
      "endpoints": [
        {
          "id": "leaseweb-tokyo-11",
          "priority": 1,
          "hostname": "speedtest.tyo11.jp.leaseweb.net",
          "ports": [5201, 5202, 5203, 5204, 5205, 5206, 5207, 5208, 5209, 5210],
          "supports_reverse": "yes",
          "supports_icmp": "unknown",
          "verification_status": "verified",
          "verified_at": "2026-09-16T17:00:00Z"
        },
        {
          "id": "datacamp-tokyo",
          "priority": 2,
          "hostname": "89.187.160.1",
          "ports": [5201],
          "supports_reverse": "yes",
          "supports_icmp": "unknown",
          "verification_status": "unverified",
          "verified_at": null
        }
      ]
    },
    {
      "id": "nl-amsterdam-clouvider",
      "order": 4,
      "enabled": true,
      "label": "Amsterdam",
      "country_code": "NL",
      "city": "Amsterdam",
      "location_confidence": "operator_documented",
      "sources": [
        {
          "url": "https://as62240.net/speedtest",
          "checked_at": "2026-09-16T16:00:00Z",
          "usage_policy": "operator_documented"
        },
        {
          "url": "https://github.com/R0GGER/public-iperf3-servers/blob/main/README.md",
          "checked_at": "2026-09-16T16:00:00Z",
          "usage_policy": "public_directory_listed"
        }
      ],
      "endpoints": [
        {
          "id": "clouvider-amsterdam",
          "priority": 1,
          "hostname": "ams.speedtest.clouvider.net",
          "ports": [5200, 5201, 5202, 5203, 5204, 5205, 5206, 5207, 5208, 5209],
          "supports_reverse": "yes",
          "supports_icmp": "unknown",
          "verification_status": "verified",
          "verified_at": "2026-09-16T17:00:00Z"
        },
        {
          "id": "leaseweb-amsterdam-1",
          "priority": 2,
          "hostname": "speedtest.ams1.nl.leaseweb.net",
          "ports": [5201, 5202, 5203, 5204, 5205, 5206, 5207, 5208, 5209, 5210],
          "supports_reverse": "yes",
          "supports_icmp": "unknown",
          "verification_status": "unverified",
          "verified_at": null
        }
      ]
    },
    {
      "id": "gb-london-clouvider",
      "order": 5,
      "enabled": true,
      "label": "London",
      "country_code": "GB",
      "city": "London",
      "location_confidence": "operator_documented",
      "sources": [
        {
          "url": "https://as62240.net/speedtest",
          "checked_at": "2026-09-16T16:00:00Z",
          "usage_policy": "operator_documented"
        },
        {
          "url": "https://github.com/R0GGER/public-iperf3-servers/blob/main/README.md",
          "checked_at": "2026-09-16T16:00:00Z",
          "usage_policy": "public_directory_listed"
        }
      ],
      "endpoints": [
        {
          "id": "clouvider-london",
          "priority": 1,
          "hostname": "lon.speedtest.clouvider.net",
          "ports": [5200, 5201, 5202, 5203, 5204, 5205, 5206, 5207, 5208, 5209],
          "supports_reverse": "yes",
          "supports_icmp": "unknown",
          "verification_status": "verified",
          "verified_at": "2026-09-16T17:00:00Z"
        },
        {
          "id": "leaseweb-london-12",
          "priority": 2,
          "hostname": "speedtest.lon12.uk.leaseweb.net",
          "ports": [5201, 5202, 5203, 5204, 5205, 5206, 5207, 5208, 5209, 5210],
          "supports_reverse": "yes",
          "supports_icmp": "unknown",
          "verification_status": "unverified",
          "verified_at": null
        }
      ]
    },
    {
      "id": "us-los-angeles-clouvider",
      "order": 6,
      "enabled": true,
      "label": "Los Angeles",
      "country_code": "US",
      "city": "Los Angeles",
      "location_confidence": "operator_documented",
      "sources": [
        {
          "url": "https://as62240.net/speedtest",
          "checked_at": "2026-09-16T16:00:00Z",
          "usage_policy": "operator_documented"
        },
        {
          "url": "https://github.com/R0GGER/public-iperf3-servers/blob/main/README.md",
          "checked_at": "2026-09-16T16:00:00Z",
          "usage_policy": "public_directory_listed"
        }
      ],
      "endpoints": [
        {
          "id": "clouvider-los-angeles",
          "priority": 1,
          "hostname": "la.speedtest.clouvider.net",
          "ports": [5200, 5201, 5202, 5203, 5204, 5205, 5206, 5207, 5208, 5209],
          "supports_reverse": "yes",
          "supports_icmp": "unknown",
          "verification_status": "verified",
          "verified_at": "2026-09-16T17:00:00Z"
        },
        {
          "id": "leaseweb-los-angeles-12",
          "priority": 2,
          "hostname": "speedtest.lax12.us.leaseweb.net",
          "ports": [5201, 5202, 5203, 5204, 5205, 5206, 5207, 5208, 5209, 5210],
          "supports_reverse": "yes",
          "supports_icmp": "unknown",
          "verification_status": "unverified",
          "verified_at": null
        }
      ]
    },
    {
      "id": "us-new-york-clouvider",
      "order": 7,
      "enabled": true,
      "label": "New York City",
      "country_code": "US",
      "city": "New York City",
      "location_confidence": "operator_documented",
      "sources": [
        {
          "url": "https://as62240.net/speedtest",
          "checked_at": "2026-09-16T16:00:00Z",
          "usage_policy": "operator_documented"
        },
        {
          "url": "https://github.com/R0GGER/public-iperf3-servers/blob/main/README.md",
          "checked_at": "2026-09-16T16:00:00Z",
          "usage_policy": "public_directory_listed"
        }
      ],
      "endpoints": [
        {
          "id": "clouvider-new-york",
          "priority": 1,
          "hostname": "nyc.speedtest.clouvider.net",
          "ports": [5200, 5201, 5202, 5203, 5204, 5205, 5206, 5207, 5208, 5209],
          "supports_reverse": "yes",
          "supports_icmp": "unknown",
          "verification_status": "verified",
          "verified_at": "2026-09-16T17:00:00Z"
        },
        {
          "id": "leaseweb-new-york-1",
          "priority": 2,
          "hostname": "speedtest.nyc1.us.leaseweb.net",
          "ports": [5201, 5202, 5203, 5204, 5205, 5206, 5207, 5208, 5209, 5210],
          "supports_reverse": "yes",
          "supports_icmp": "unknown",
          "verification_status": "unverified",
          "verified_at": null
        }
      ]
    }
  ]
}
